{
  "schemaVersion": 2,
  "id": "vibe-harness-core-offline-reference",
  "approvedAt": "2026-10-13T07:18:09.624Z",
  "suite": {
    "id": "vibe-harness-core",
    "version": "2.2.0"
  },
  "mode": "offline",
  "proof": "contract-replay",
  "fingerprint": {
    "suiteHash": "83deb942c4b141aecf647705c2893b1dc7a4ae3e3164e312b3d3fb1c92d6fc87",
    "runner": "offline-replay@1",
    "model": "fixture",
    "agent": "offline",
    "configHash": "fixture-v1",
    "assets": {
      "aggregateHash": "f90dc99a89aff1c3c709f1cd1dba20c44a1e4e789ce09a1bcb444518ef91870c",
      "groups": {
        "config": {
          "fileCount": 42,
          "hash": "5377268ee3641f6d23e1ff36c854b9e44797eddd54aa7d2a6bd06a3be33165fa"
        },
        "hooks": {
          "fileCount": 21,
          "hash": "98d6f5423d725f2c7eb9193c3407d9e9fcf67855eb4c52c4ba77bdb84dcea267"
        },
        "rules": {
          "fileCount": 50,
          "hash": "bb806d1dc6618a5a810b1390de8692fa83c3d2dce684803223e032b923d4d97a"
        },
        "skills": {
          "fileCount": 144,
          "hash": "ff79c56c060db05d6d9f9ca4be2cdf8270539f3538a3cc06d9dac01ecf2251a3"
        }
      }
    }
  },
  "capabilities": [
    {
      "id": "api-and-interface-design",
      "caseCount": 1,
      "passedCount": 1,
      "score": 1
    },
    {
      "id": "ast-grep-structured-search",
      "caseCount": 3,
      "passedCount": 3,
      "score": 1
    },
    {
      "id": "bug-finding",
      "caseCount": 2,
      "passedCount": 2,
      "score": 1
    },
    {
      "id": "chrome-devtools-mcp",
      "caseCount": 3,
      "passedCount": 3,
      "score": 1
    },
    {
      "id": "clarify-requirements",
      "caseCount": 2,
      "passedCount": 2,
      "score": 1
    },
    {
      "id": "define-goal",
      "caseCount": 1,
      "passedCount": 1,
      "score": 1
    },
    {
      "id": "eval-driven-development",
      "caseCount": 1,
      "passedCount": 1,
      "score": 1
    },
    {
      "id": "eval-evidence-boundary",
      "caseCount": 1,
      "passedCount": 1,
      "score": 1
    },
    {
      "id": "frontend-design",
      "caseCount": 1,
      "passedCount": 1,
      "score": 1
    },
    {
      "id": "governance-analysis-depth",
      "caseCount": 1,
      "passedCount": 1,
      "score": 1
    },
    {
      "id": "governance-evidence-state",
      "caseCount": 1,
      "passedCount": 1,
      "score": 1
    },
    {
      "id": "governance-sensitive-data",
      "caseCount": 1,
      "passedCount": 1,
      "score": 1
    },
    {
      "id": "governance-verification-attribution",
      "caseCount": 1,
      "passedCount": 1,
      "score": 1
    },
    {
      "id": "hook-capability-contract",
      "caseCount": 1,
      "passedCount": 1,
      "score": 1
    },
    {
      "id": "hook-path-resolution",
      "caseCount": 1,
      "passedCount": 1,
      "score": 1
    },
    {
      "id": "hook-policy",
      "caseCount": 3,
      "passedCount": 3,
      "score": 1
    },
    {
      "id": "install-lifecycle",
      "caseCount": 6,
      "passedCount": 6,
      "score": 1
    },
    {
      "id": "rtk-output-compression",
      "caseCount": 6,
      "passedCount": 6,
      "score": 1
    },
    {
      "id": "runtime-cross-repo-rollout",
      "caseCount": 1,
      "passedCount": 1,
      "score": 1
    },
    {
      "id": "security-and-hardening",
      "caseCount": 1,
      "passedCount": 1,
      "score": 1
    },
    {
      "id": "systematic-debugging",
      "caseCount": 2,
      "passedCount": 2,
      "score": 1
    }
  ],
  "overallScore": 1,
  "criticalPassRate": 1
}
