{
  "schemaVersion": 1,
  "id": "cognis-core-offline-reference",
  "approvedAt": "2026-07-28T00:00:00.000Z",
  "suite": {
    "id": "cognis-core",
    "version": "2.0.0"
  },
  "mode": "offline",
  "fingerprint": {
    "suiteHash": "ec989dafe61650d8463f1c49ca41c71189acdfae169b159ae2ca1b6dc9deb5fa",
    "runner": "offline-replay@1",
    "model": "fixture",
    "agent": "offline",
    "configHash": "fixture-v1"
  },
  "capabilities": [
    {
      "id": "ast-grep-structured-search",
      "caseCount": 1,
      "passedCount": 1,
      "score": 1
    },
    {
      "id": "chrome-devtools-mcp",
      "caseCount": 3,
      "passedCount": 3,
      "score": 1
    },
    {
      "id": "hook-policy",
      "caseCount": 3,
      "passedCount": 3,
      "score": 1
    },
    {
      "id": "install-lifecycle",
      "caseCount": 6,
      "passedCount": 6,
      "score": 1
    },
    {
      "id": "rtk-output-compression",
      "caseCount": 5,
      "passedCount": 5,
      "score": 1
    }
  ],
  "overallScore": 1,
  "criticalPassRate": 1
}
