{
  "schemaVersion": 2,
  "id": "vibe-harness-core-offline-reference",
  "approvedAt": "2026-10-22T03:16:49.106Z",
  "suite": {
    "id": "vibe-harness-core",
    "version": "2.2.0"
  },
  "mode": "offline",
  "proof": "contract-replay",
  "fingerprint": {
    "suiteHash": "3a37e2549d5ea91300afd50da49b47f17d9b75ab23c0d89d8a92be98988d680a",
    "runner": "offline-replay@1",
    "model": "fixture",
    "agent": "offline",
    "configHash": "fixture-v1",
    "assets": {
      "aggregateHash": "870f0ca612fa71215963285c4fd8dfc9a364f7c0f7a5bd29f7ae80267911b850",
      "groups": {
        "config": {
          "fileCount": 44,
          "hash": "fec95e238d43dffb7e239c6cd6c59c8b57e05f0660c18f7da8b696d5cc98f2f9"
        },
        "hooks": {
          "fileCount": 19,
          "hash": "321aa3e7051719235848ed202d6ca926cc45e6c80347fcbcb04e911a08833b10"
        },
        "rules": {
          "fileCount": 45,
          "hash": "ecfb4f3a314cac7b11c0399155336f719c7642edbb94f1c4d97779cb94b94fe6"
        },
        "skills": {
          "fileCount": 166,
          "hash": "6ed3829eec108dddcd2af1429896656441dfd050e03999258914251fc7010a66"
        }
      }
    }
  },
  "capabilities": [
    {
      "id": "api-and-interface-design",
      "caseCount": 1,
      "passedCount": 1,
      "score": 1
    },
    {
      "id": "bug-finding",
      "caseCount": 2,
      "passedCount": 2,
      "score": 1
    },
    {
      "id": "chrome-devtools-mcp",
      "caseCount": 3,
      "passedCount": 3,
      "score": 1
    },
    {
      "id": "clarify-requirements",
      "caseCount": 2,
      "passedCount": 2,
      "score": 1
    },
    {
      "id": "define-goal",
      "caseCount": 1,
      "passedCount": 1,
      "score": 1
    },
    {
      "id": "eval-driven-development",
      "caseCount": 1,
      "passedCount": 1,
      "score": 1
    },
    {
      "id": "eval-evidence-boundary",
      "caseCount": 1,
      "passedCount": 1,
      "score": 1
    },
    {
      "id": "frontend-design",
      "caseCount": 1,
      "passedCount": 1,
      "score": 1
    },
    {
      "id": "governance-analysis-depth",
      "caseCount": 1,
      "passedCount": 1,
      "score": 1
    },
    {
      "id": "governance-evidence-state",
      "caseCount": 1,
      "passedCount": 1,
      "score": 1
    },
    {
      "id": "governance-sensitive-data",
      "caseCount": 1,
      "passedCount": 1,
      "score": 1
    },
    {
      "id": "governance-verification-attribution",
      "caseCount": 1,
      "passedCount": 1,
      "score": 1
    },
    {
      "id": "hook-capability-contract",
      "caseCount": 1,
      "passedCount": 1,
      "score": 1
    },
    {
      "id": "hook-path-resolution",
      "caseCount": 1,
      "passedCount": 1,
      "score": 1
    },
    {
      "id": "hook-policy",
      "caseCount": 3,
      "passedCount": 3,
      "score": 1
    },
    {
      "id": "install-lifecycle",
      "caseCount": 6,
      "passedCount": 6,
      "score": 1
    },
    {
      "id": "runtime-cross-repo-rollout",
      "caseCount": 1,
      "passedCount": 1,
      "score": 1
    },
    {
      "id": "security-and-hardening",
      "caseCount": 1,
      "passedCount": 1,
      "score": 1
    },
    {
      "id": "systematic-debugging",
      "caseCount": 2,
      "passedCount": 2,
      "score": 1
    },
    {
      "id": "tool-routing-contract",
      "caseCount": 8,
      "passedCount": 8,
      "score": 1
    }
  ],
  "overallScore": 1,
  "criticalPassRate": 1
}
